{
  "$schema": "./schemas/outcome-contract.schema.json",
  "outcomeId": "northstar-material-recovery-2026-07",
  "version": "1.0.0",
  "status": "draft",
  "objective": "Protect at least 95.0% of committed NX-400 revenue within 21 days without reducing quality or exceeding the bounded recovery budget.",
  "businessSignal": "Copper Alloy C-17 aboard the Meridian Horizon is diverted and expected 12 days late; usable inventory reproduces at 5.4 days.",
  "baseline": {"value": 8700000, "unit": "USD_exposed", "label": "CALCULATED"},
  "current": {"value": 0, "unit": "percent_protected", "label": "OBSERVED"},
  "target": {"value": 95.0, "unit": "percent_protected", "deadlineDay": 21},
  "interimTarget": {"value": 93.0, "unit": "percent_protected", "deadlineDay": 14},
  "hardConstraints": [
    {"id": "budget", "rule": "response_cost <= 420000", "value": 420000, "unit": "USD"},
    {"id": "quality", "rule": "quality_threshold_reduction = 0", "value": 0, "unit": "threshold_changes"},
    {"id": "supplier", "rule": "approved_or_conditionally_approved_suppliers_only", "value": true},
    {"id": "communication", "rule": "external_customer_send = false", "value": false},
    {"id": "authority", "rule": "human_action_contract_required", "value": true}
  ],
  "softConstraints": ["prefer interplant transfer to full air freight", "minimize unproductive overtime"],
  "leadingIndicators": ["usable C-17 coverage", "quality release", "material arrival", "Line C operational state"],
  "laggingIndicators": ["committed revenue protected", "orders delivered", "quality incidents", "final spend"],
  "businessConsequences": ["strategic revenue", "customer milestones", "service penalties", "production continuity"],
  "requiredEvidence": ["supplier and carrier confirmation", "inventory reconciliation", "bill-of-material dependency", "quality release", "tool-confirmed observations"],
  "requiredApprovals": ["Plant COO", "CFO delegate above $250,000", "Global Procurement VP", "independent PACT Auditor"],
  "permittedActionClasses": ["quality_validation", "finance_authorization", "supplier_commitment", "inventory_transfer", "production_resequence", "carrier_reservation", "labor_confirmation", "customer_draft", "work_item"],
  "contentHash": "sha256:generated-at-runtime"
}
